,review_id,app_id,review_text,label
151,136516681,1934040,It's fun to play on the controller <3,1
152,136517969,1934040,very attractive sandbox survivor. nice graphics,1
153,136517189,2103530,"A very awesome game, even though some (not all) concepts are similar to Melvor Idle which I don't mind, I like the these type of idle based html/web like based games.",1
154,136566115,694990,"An old-school platformer with a lot of heart.

The game's controls are responsive, and the progression is well-paced. Throughout the levels, our goblin collects scattered coins which can be spent on upgrades, such as the beloved double-jump. Cleared levels can be replayed at any time, allowing him to access previously unreachable areas with his newfound abilities. For those seeking an extra challenge, the game can be completed without any upgrades, with an achievement as a reward. From time to time the goblin will encounter bosses, which, although easier compared to the levels themselves, are creative and add a nice variety to the gameplay.

An interesting aspect of the game is that all the sound effects are created using the developer's voice, which may initially feel unusual and take some time to get used to. Some players may find it awkward or irritating. However, it's worth noting that the game was made by one person, and this unique approach to sound effects adds to its overall ""hand-crafted"" feel.

It's impossible to die completely in this game. When all continues are lost, the goblin is sent to the Underworld level with infinite attempts (after all, you can't die when you're already dead), and clearing it resurrects him with 15 extra continues. This process can be repeated indefinitely, ensuring that the player won't lose all of their progress and have to start over. However, the game can still provide a challenge, especially for those aiming to collect all the coins.

Overall, this game is a great choice for satisfying old-school platforming cravings. It never gets boring thanks to unique and varied level designs, enjoyable boss fights, appealing pixel art, and just the right amount of difficulty to keep the player engaged. The only minor downside is that it runs at 30 fps due to engine limitations, but it doesn't detract from the overall experience. 
Give it a try – you might just enjoy it.

Disclaimer: I worked on the Ukrainian translation for this game.",1
155,136549709,2156300,"Steve if you want to remake or new episode for College Kings please use these assets or similiar this. Because this is so amazing, realistic. It would be great if it was. I liked this game can't wait to see more episode.",1
156,136549873,2156300,"unfortunately the excitement I had for this game dwindled very quickly. Them saying that we get future episodes for free, is like an unknown time tomb. With the first episode being under an hour long, it makes me feel like my money was wasted. The story had a lack of excitement, and the only ""scene"" it had left much to be desired. The animations seemed very well put together, but I wouldn't recommend.",0
157,136563471,1772830,Very fun grappling mechanic,1
158,136566719,1811990,this game is very wild(frost),1
159,136566624,1811990,"Impressive, very nice",1
160,136563948,1772830,"Played the demo completely through twice and instantly wanted more. Bought it the moment it went available and it has not disappointed at all.

The grapple hook is one of the best in the biz, feeling a lot like Umihara Kawase in the way that it acts a lot more like a bungee cord than something you'd see in a game like Bionic Commando.
The story so far has been really engaging and I want to know more and more about the world and characters. Soundtrack is great, and the world makes me want to go back to areas to see what I can do with new abilities.

Legit the best Metroidvania I've played since Hollow Knight.",1
161,136564000,1498040,"Very fun and immediately addicted to it.
In a nutshell, this feels like Noita + Brotato/Vampire Suvivors.
I really love that you can make wimbo combos throughout the games. It delivers the best part of roguelike game - the fun of insane build.
Can't wait to try out more combinations.",1
162,136549850,2285400,"Surprisingly fun. Ultra simple and needs a bit of work, but killed an hour for us while waiting for a game to download.",1
163,136549877,2285400,"Surprisingly fun to play, perfect whilst someone is downloading another game on steam.",1
164,136547814,2156300,The game put me to sleep slow as hell,0
165,136562281,2156300,"This review is not because I want a refund but I do want to see future episodes well maybe I like watching Car Crashes in the Highway. Spoilers AHEAD. Number 1.IF YOUR LOOKING FOR NAKED WOMEN AND BASIC PORN GO AWAY ( i believe there is no naked tag on the game ). I would like to say though even Nicholas Sparks does steamy sex in his books/movies it did not hurt him but that is not what the development team is going for (you can portray Intimacy with nudity and not be pornographic, sex sells ). No 2. Price point in 2009 Minecraft was sold for 13 dollars ( you can google this ) so is Unscripted.. do not expect Minecraft level of play ability. No 3. I ran into Saving problems while I was save scumming all the possible options to get all the possible 4 vibes which i only did 3 romantic / dreamer / Joker. (fixed by turning off the game and turning it on again ) No. 4 I got some flashing white blank in the middle of the screen during some scenes. which only appeared a few times but still annoying. also Trying to keep track of the Vibe changes seems to have stopped after the Demo version of the game. also the relationship points for ( trust ) the River char. only seemed to show during the first episode. making everything you did before demo and after demo not integrated. i.e you will go on a date with River no matter how bad you fucked up. No. 5 Second girl ( i think the name was angela lol ) during the pitch meeting seems more filler at this point to express how shitty the MC's life really is and the whole important choice there really was not that important but to give you different ways you can react to rejection / opportunity. No. 6 At least the most of the Graphics as far as i can tell ( yes i breeze thru alot of AVN ) are not recycled or horribly out of human proportions. but  i think they can do better.. ( they could have made the mc character more pleasant looking maybe not like Tom Cruise or Zac Efron but just a little more leading man like also why does not he look like his bro. ? he adopted? ) No 7. (im trying to get to ten but should have stopped at 5.) The sound Still comes on when i turn on the game even when i muted it on a previous run thru it didnt remember my settings from past run? ( ya im nitpicking at this point i know ) No. 8. one of the other reviews Said not enough save slots i didnt believe till i started scumming to try to get all the possible Vibes so yes this is the truth on that matter. No. 9 ( almost there ) During the Sex Scene you asked if you want to skip it and manually control it some how that part still buggy because i clicked no to not skip and yes to control it and it skipped. ( ya i know its a bug? still buggy at launch? dont worry i played 7 days to die thru what felt like 10 years of early access and ya that shit i still play today still buggy as hell or id like to think of it as a feature ) No. 10 Finally with all the bad things i might have said i would still wait to see how it ends up i been waiting for VTM Bloodline 2 since what 2019? at least Unscripted actually is out.",0
166,136549687,1949030,"Very promising so far. It seems like they combined the best parts of Crimes and Punishment with the best parts of the Sinking City. The riddles feel challenging and rewarding. I also really enjoy the graphics, the atmosphere, and the dialogue.",1
167,136547742,1118110,"This game... where to begin, it's bad...

(Dude, you upvoted it)

 Yea, well, I love it. And I will keep playing it.

Lack a bit of ""RPG"" style, level up system, unlock new tools, new skills, better equipment.

I expected a ""sequel"" to gold rush, it wasn't.

Game is simple, reminds me of farming simulator in it's starting days, and I love it today.

So yea, it's bad, but hopefully, sequels will get good and better.",1
168,136549789,1118110,"I play prologue of this game and it's great. So, finally it's full released! 
Do u wanna test and feel real hardcore workflow of crazy man? Learn and play as a coal miner
it's not a offfice manage, it's a dirty job baby :D
Complete task, inproove your minig skill and buy new equip",1
169,136564866,307950,Shity mobile port,0
170,136564937,307950,good socom like finally on steam pog,1
171,136565139,307950,just play rogue company,0
172,136565224,307950,"(I have far more playtime through the standalone launcher prior to the Steam release.)

First and foremost, allow me to say that Caliber hasn't always been the game that it is now. If you have ever heard anything negative about this game, chances are those things no longer exist. The developers have been very open and willing to listen to the community in order to make this game worthwhile. And with that said, Caliber is certainly a game worth playing.

If you've ever played Ghost Recon Phantoms or SOCOM, Caliber is basically the spiritual successor to these classic third person shooters. There are a ton of unique operators to pick from, team based gameplay in which each person fills in their own role, fun co-op missions, various game modes, and no P2W. If you're a fan of third person shooters, tactical shooters, or shooters in general, you absolutely should give Caliber a try.

As someone that has been playing games since the early 90s, I would like to thank the developers for not only listening to the community in order to improve this game, but for making such a game to begin with. Caliber offers up a nostalgic experience, harkening back to a time when shooters weren't mindless, and horribly generic. You've done good, 1C. Keep it up!",1
173,136565585,307950,"Ok, here we go (been waiting for this since 2019)

Remember Ghost Recon phantoms? SOCOM? 
Any third person shooter that relies on teamwork?

This is game made for fans of that, if youre BF or CoD player coming here with ""Oh it doesnt have first person"" move along this aint for you anyway.
As a third person shooter this game has it everything you need to enjoy, while animations arent top notch like in GR Breakpoint, this game does it decent enough.
Guns feel good and different.
There is one problem that new players might enncounter and that is famous grind.
New players might get overhelmed by amounnt of grind u need to put out, but this is better system thann it was before, where you would have to buy new operators only with gold (each week u would get 3 new operators that would b availeble for blue credits).
All to all - You like third person? You have time? Dont mind a grind? GO FOR IT!!!
....and yeah, learn Russian!",1
174,136549279,2008820,got me a girlfriend who iam marrying in 2 days. very  good game,1
175,136548957,1974290,more sentinels. a must buy for any fan.,1
176,136562411,2156300,"The plot is promising, has not yet passed the game completely, but I want to write an early review. I liked the gameplay, the general immersion in the game and even the interface looks very harmonious, so you can relax during the game and play with a cup of coffee.",1
177,136565914,1469540,"Definitely worth every single penny, probably we will get much more in the future with updates",1
178,136565796,2216700,i have to say i just love the way the music and the voice acting of characters flow during gameplay. its a nice job well done,1
179,136565458,2094270,"Lightracer Spark is a visual novel set in a Sci-Fi world. It's pretty much a narrative game where your choices matter as you progress through story. There are also some strategy elements, such as building various buildings, collecting resources, implementing space stations modules etc. I have to say that this game really surprised me how well made it is. 

Story/Narrative:

I have to say that story is quite well written and everything is connected with each other. There is a lot of text to read, a lot of choices to make. Currently you can only play Chapter 1 (new chapters will come as DLCs) that has many mini chapters in it, and as you progress the story, you're able to learn a lot about who you are, what is your mission and what you're capable of doing. Prologue is some sort of Tutorial that shows you and teaches you how to play the game. The other chapters are specific stories that tell you about certain events. Now, the biggest pat of this game is that as Amender (controller of planets and universes) you have specific traits that influence the story. You can pick between 5 different paths and each brings unique traits and bonuses. In the story there will be some choices that you can complete and they have difficulty, ranging from very easy to very difficult. They do somewhat influence the story as it makes you get different ending and you don't collect all the information needed but the higher traits you have, the easier it is to complete them. For example, you'll have to talk about history of certain civilization and to complete that choice, you'll need decent knowledge on ""Strange Worlds"" that is a specific trait in the game. All in all, I have to stay that story is quite unique and it does get you hooked but I just wish that developers added the button that you can speed up the text since most of the time you yourself have to click Continue in order to progress through story and text is quite slow which leaves you enough time to read everything.

Strategy elements:

I personally think strategy elements don't influence the game that much. Yes, you have to collect resources such as energy points, technology points and population in order to complete some chapters, but at the same, you collect those quite fast and buildings are quite cheap to build. You can also upgrade them which allows you to gain resources faster. There are special buildings that do require some effort to build, and they bring you various bonuses and materials that are later required to build certain buildings. In general, it's not time consuming but you'll sometimes forget that they even exist or forget to upgrade them since you're mostly focused on the story. There is also war in this game. I personally think it's quite unfair for other provinces and countries to get attacked by you. Because you're technologically stronger and the higher population you have, the easier it is to recruit troops. Enemies are quite easy to kill and they won't pose a threat. I think it's more beneficial to just focus on your military rater than pure resources. 

Issues:

Even though the story is quite well written, music and images are well made, I can't suggest this game for everyone. First of all, the mechanics of the game are quite easy to master and the game doesn't offer much content. Yes this is visual novel, but at the same time developers could have given us something more unique to do in between the stories and the stories progress way toooo fast. As soon as you're done with one mini chapter, you can instantly go to the other. As I already mentioned, building and waging war isn't anything special and it really doesn't bring you much. Time in the game can be slowed down or fastened up. If you have enough time to read through chapters and chapters of the story and you really do like to immerse yourself in futuristic world where AI helps you with everything, then surely this game is for you.  

Overall score: 7.5",1
180,136556093,2189970,"It's a neat little game. I haven't gotten very far, but it's been fun.",1
181,136563387,2299240,"Aww, I wasn't expecting that ending. I'm excited to play episode 3 of the Fateweaver series.

Death",1
182,136566050,307950,"Played it before it came to Steam.
It's like an Ubisoft (The Division/Siege) game but without it's biggest flaw - being made by Ubisoft.",1
183,136566892,307950,"I played the Caliber since early beta and, as one can see in my achievements list, collected nearly all content available for now. And what can I say about pros and cons of this game.

Pros:
+A lot of game modes, both PvP and PvE. Not all of them are equally populated but you can find a match even in not so popular modes pretty fast.
+Over 60 characters to choose from. Different operators offer different playstyles, some are good for mowing down bots, some are perfect for PvP.
+Nice visuals with decent system requirements.
+No 'pay2win' - all operators can be purchased with ingame currency (and you don't need to grind for weeks to buy one you like).

Cons:
-Visual customisation system are lacking. You can apply different camos to the operator but most ot it can be obtained only during events or for premium currency. Nearly all of the skins with really unique looks are premium.
-Leveling up the operator can be tiresome - later levels require lots of XP and credits to grind.

Summary: good 'heroic shooter' in realistic setting with lots of coop and competitive activities. It's good to see it on Steam at last.",1
184,136567041,307950,"Отличная игра, не такая скоростная как шутеры от первого лица, успеваешь хлебнуть пивка. Всем рекомендую потратится на премиум, быстрее качаешься",1
185,136571118,2216700,"i never expected after defeating some bosses a number of times they actually evolve and they become tougher.
love the fact that its challenging and have to create new strategies on defeating them afterwards",1
186,136570789,2109430,"Channels the Tron aesthetic through and through, story is good and encourages multiple playthroughs. Puzzles are fun, smart and just difficult enough.

Highly recommend!",1
187,136571278,2156300,"EPISODE 1 is very small , many glitches are there. The story is fine but not much grabbing.",0
188,136569545,2156300,"I'll preface this by saying, it's still very early, and this is just one episode, but here are my impressions so far.
1.  There are really no options.  You have one woman to impress and god forbid you choose wrong in one of the options you have, she'll friendzone you.  If you didn't find her attractive (and I really didn't--she was too heavy for my taste), then too bad.  She's the only choice in the game so far.
2.  No roll back.  Did you hit one of the choices accidentally?  Too bad. Replay the entire thing, or create tons of saves as you go.
3.  This next one goes towards the ""dating sim"" aspect.  If the one woman pisses you off (which she did), there's no option to tell her to go **** herself and walk off.  You're forced to be nice.  I would really have liked a ""b*tch, I have enough friends"" option.  I've never let a woman friendzone me IRL, and I certainly don't want to do it in a game.  There's great satisfaction in ghosting women like that.
4.  I suppose because it was by the same people that did College Kings, I was expecting at least the chance to have some good, meaningless sex.  That was not to be the case.  I suppose this game is G rated, or PG at best.  My hope is that the more episodes that come out, the more this will change.  I can ""not have sex"" with as many women as I want IRL. There's no need to go to a game to do it.
5.  I both understand and enjoy the necessity to build up to a relationship.  It was my favorite part about games like BaD and College Kings, but both of those games gave you significant feedback when you did something that would cause a girl to friendzone you, or not like you, or whatever, and you weren't friendzoned... you were merely ""in progress"" and the girls kind of let you know that.  In this episode, I got friendzoned and had no idea why.  None.

Again, however, this is all after just one episode.  Perhaps there's still hope and I do look forward to the upcoming episodes, but the lack of a rollback option is just AWFUL!  If you want to add an ""ironman"" mode where you can't rollback, by all means, do so.  I generally do my first playthrough keeping as true to how I would personally answer as I can and some kind of ironman mode for that would be fine, but to force everyone to play that way every time is absurd.

TLDR: As far as the final recommendation, I'm going to say for those seeking an AVN, this isn't it.  This is a teenage visual novel at best... no adult content whatsoever.  The dialogue is fun, even funny at points, but in it's current 1 episode state, I can't in good conscience, recommend it in its current state.  I will update the review as new episodes are released.",0
189,136571169,2109430,"Not badly written
Short and sweet

But it’s a tron!

Tron lives!",1
190,136571418,1811990,"It's difficult, but not absurdly so - if you have played card based games in the past, you need to adapt to the unique counter twist this game puts on things. But the moment that clicks, it just becomes an incredibly fun puzzle to win the battles.

The runs are fairly short (an hour to two, depending on how long you think about turns), which is a real plus for me - I can play a single run and then hop and do something else for a while.
The progression unlocks different tribes (card sets) and some new cards, but the cards you have in the beginning are completely valid to win a run.
Cards can be upgraded in a run to focus on different builds.
The art style is amazing. The UI is great, it runs smooth and the music is incredibly cool.

And if you're 1 coin short in the shop and click an item repeatedly, the shop keeper takes pity on you and sells it regardless. Whats not to love?
Give it a try. It's a great game.",1
191,136571194,1811990,"Monch

My beloved",1
192,136571936,2109430,"Great writing, music and really strong visual presentation",1
193,136564796,307950,"So far, so good",1
194,136564863,307950,Been playing this game since before it launched on Steam. There's really nothing like it in terms of 3rd person shooters. If you can get past some of the grind and slight balancing issues it can be a very chill shooter to pass the time with. Really fun game.,1
