,review_id,app_id,review_text,label
530,136604401,2321460,"So you are one of the last T-rex's on the planet and you want to change your life. you decide to move to Synth-City to seek opportunities and become a successful mechanic for all your tech repair needs. 

Game mechanics are simplistic but enjoyable, It works well for it's purpose, doesn't feel too hard or easy. I enjoy the pace that new mechanics are added into the game, it keeps things fresh as you learn more about your customers, your own story, and life in Synth-City.
     The characters all feel very natural. they all have unique, interesting personalities and dialogue that goes well with them.
The mood detector is a really cool feature that I think adds a lot to the interactions, especially alongside the characters expressions and effects. The dialogue itself is interesting and you're given a lot of options to respond to characters with. Sometimes your choices aren't obvious, and I really enjoy that.

The music and the style of this game both come together really well to create very immersive, very good looking settings.

There were some issues based around the timed repairs. digging for the right component was difficult because you basically had to guess where they were located(since the pile of components wasn't very accurate to where the components actually were) and it got kind of finicky. The components sometimes awkwardly sat on top of things they shouldn't (Like the case of the gadget for example)

CONCLUSION
If you feel even slight interest or curiosity for this demo, I highly recommend trying it,  I think it's likely you will have a very satisfying experience.",1
531,136604005,1091920,"https://steamcommunity.com/sharedfiles/filedetails/?id=2961605562
Close



Plantera 2 Golden Acorn is the sequel to 2016's hit farming-style clicker, Plantera. But is the sequel as good as the original? Absolutely. I had dubbed the first iteration, Carpel Tunnel Simulator and part 2 is no different. It adds a few new elements like the addition of the grand tree with said golden acorns, but it's the same cozy clicker game, that in my opinion sh!!ts on Cookie Clicker cause Plantera is just a lot cuter.

Perfect for just turning your brain off to, with all the whimsy and clicking & for the low price of 4.99 USD- I cant recommend this game enough to everyone.

I will say this though, after playing both Plantera games, The Golden Acorn feels a lot shorter. Cause after about 3 1/2 hours I 100% it. While part 1 took me about 13 hours. Still I'm having fun.",1
532,136604164,1091920,"Fun management and adorable upgrades. The only ""complaint"" I could possibly have is there should be more achievements. I managed to get all of them in 4hrs and I'm still unlocking things. Other than that it's a fun time consuming game.",1
533,136605052,1527950,"One of the best turn  based strategic RPG's out there in the world today. Immersive experience that will keep your base building, battle strategy, survival skills and thirst for exploration held high through the entire 100 hr estimated play through. Well worth the $ for such an incredible experience, not to mention the kill cam shots are worth their weight in gold! Bravo!",1
534,136605215,1811990,Game is fun but the balance is pretty grabo,0
535,136605160,1811990,"Played the demo and couldn't wait for the game to come out.  More difficult than other deckbuilders out there, and sometimes you are dealt a bad hand, but overall very fun with plenty of replay value.  Definitely feel accomplished as you progress through the game.",1
536,136605088,1811990,the games been out for less than a day and ive already put over 7 hours into it clearly its good,1
537,136605346,1811990,"The games art music SFX and VFX is just amazing. there is tons of variety when it comes to cards enemies and allies, But as others have mentioned the balance is a little ehh as some things can just fuck you over and, your hero (the guy you need to keep alive to win) typically has single digit health putting balance aside this game is wonderful and seems like it will have a great future.",1
538,136605450,1811990,YALL ARE CRAZY FOR GIVING THIS MIXED REVIEWS,1
539,136603726,307950,"My first match was againts some mofos who paid for premium skins (thoes have benefits for the character you are using)
also, everything is sooooooo overpriced.

An competitive fps with p2w elements is a nono.
",0
540,136603849,307950,FTP jenk.,0
541,136604221,307950,"It could use some polishing, but it's free and feels pretty good in terms of progression and roles.",1
542,136605867,1919720,"This is a good game. This is a very good game. But this was released out of early access way too quickly. The content Available is almost the same amount of content available when it was in EA which is very disappointing because what's here is amazing but it's just lacking. I wish i could recommend this game but in it's ""current"" state, I Just cannot.",0
543,136604880,1919720,"It's good. Not Vampire Survivors good, but good.

In all seriousness, the game is good. There's nothing visually fancy, but if you're looking for something similar to VS this should give you what you want. There's 12 weapons, 5 characters, 3 stages, and some permanent upgrades. No fancy passive abilities or weapon merges (that I've seen).

Just don't be a silly goose like I was. When you select the mission you're doing for a map, you can select all 5 difficulties, which I thought would unlock the prior goals as I completed them. I was wrong. For example, to unlock level 5 blacksmith upgrades, you need only survive 90 seconds and then kill 400 enemies. I've done this twice, but never got level 5 upgrades because I died before surviving 500 seconds following the 400 enemies. So I 'completed' the goal but died, nulling the goal. Thus, if I'd only selected the first and second missions, I would already have upgraded my weapons (some of them at least) to level five. Well, you live and learn I suppose.

7/10",1
544,136603881,1949030,Phenomenal game so far. The atmosphere Frogwares created is perfect!,1
545,136605290,1949030,"It's not a Chapter One level of game but it's still remarkably captivating and fun. It's a smaller game and not exactly an open world (side quests are barely there and usually has to do with the main campaign) which it's fine as the story that it needs to tell works. Many references to Chapter One which makes me glad that its fully canonical now in the saga and a direct continuation of young Sherlock growing into the famed detective. I wish theyd elaborated more of John and Sherlock's friendship but there were its wholesome moments throughout the game. For.me.its clear they'll release more games to the saga and grow them even more into the unbreakable loyal bond they have.

I'm high so this is my honest review",1
546,136604473,307950,Great game for the ppl who love grinding,1
547,136605671,307950,"Zen's Pros :
✅detailed & realistic graphics
✅fast-paced gameplay
✅lots of unique characters & skill trees
✅missions & maps are just great 
✅smooth performance (just played PVE)
NO CONS ~ Keep it Zen✅  
❤️0 Money units ~ Sin-Game Shops & Pay2Sin is a nono❤️ 
❤️Enjoy a game to the max & move on to the next❤️",1
548,136605317,307950,"- the game is pay-to-win, you can exchange gold for credits to unlock super op operators and upgrades
- the sprint and ammo system is doo doo
- you can see people through every wall in the game via operator reveal logos (dumbest thing you can ever implement in a shooting game.)
- there isn't any shoulder swapping 
- the movement is so sluggish and linear feeling
- I don't even want to mention the amount of UI inconveniences I ran into within my hour of playtime

This game just feels like a mobile game more than anything, it really isn't worth the playtime. Go play something else and save yourself.",0
549,136604887,307950,i hope you guys got asia server for better gameplay other than that new style of gaming im really enjoying it,1
550,136605818,307950,"That stupid idiots type of game that matches pro level pre-made teams with completly new players ruining any chance of progress.
I find almost impossible to level up an operative, raise ""curency"" to unlock new operators and to simply have a chance to win.
If you get stomped because of the incredible bad matchmaking you can surrender but most new players dont do that so you are stuck in a 10-15 minute game where you cant win and get banned from the game mode.

You have a few game modes but only anihilation is resonable for a new player, the rest are counter strike based modes.

Simply avoid if you dont want to waste 50 hours to get over the incredibly difficulty grind curve that is made on purpose to make people pay for progress
PS: there is only PVP, the pve is unplayable and barely working",0
551,136604381,307950,"I would like to start off by saying I am really liking the game in the 5 hours i have played thus far. For anyone who played Socom 2 back in the day this game can really bring back some of those precious feels we had back then for our beloved game. I am really excited to play more and see all that is has to offer. I 100% recommend giving it a chance especially because its F2P.

In closing I can say I am highly turned off by the micro-transactions. The pricing is insane. $16.50 for 1 skin....",1
552,136605929,307950,"I was excited to play this game but it just boots straight into a black screen. have a 2080, 5800X3D and 32 gigs of ram. Shouldn't have an issue starting this game up.",0
553,136604157,1772830,"I am really enjoying this so far, will update this review once I've completed the story.",1
554,136605288,1772830,"Overall solid metroidvania game. Core gameplay loop revolves around physics interactions (not just the grappling hook) and it allows for some really fun movement tech once you get the hang of it. Bosses have been decent on challenge (around 1-3 runs for me per boss so far), but I think it'll very much depend on how good you get at understanding movement in the game. There's currently limited progression in the form of weapon upgrades, but given that you have to go out of your way to get the upgrade mats, it feels more like a case of ""the good get better rewards"".

I think the skill ceiling for this game is high, and the game does a good job of steadily encouraging you to improve the way you think about the space around you as well as your level of execution. Given that the game actually comes with an editor right out the gate, expect to see some really cool custom levels and speed runs.",1
555,136604309,1919720,"Can't leave Early Access without any content patch for release. Its shady arse tactics like this is why i hate Early Access, pretty much implement a faith based system where you can support developers works early, only for developers to never finish the game, release it, or even fix it. 

Then again when people throw money at you why wouldn't you run not like anyone can stop them.",0
556,136605931,1811990,"Before I say anything else, this game is HARD. It can be very unfair if luck doesn't go your way, and skill with deckbuilding games similar to this is almost a must. I would advise only buying this game if you are okay with that.

However, this game can also be very fun once you get the fundamentals down. Don't expect to win on your first several attempts, and spend time learning what everything does. There are several ways to scale and keep up with the difficult enemies this game throws at you, and swapping the places of your units on the field every turn to prevent the most damage is not only necessary, but adds another layer of strategy to the game.

There is also an amazing twist once you beat the final boss the first time, but I wont spoil that here.

The art is amazing and the music and sound design are just as good, so overall I would recommend this game, as long as it gets a few minor tweaks that I'm sure will be added soon.",1
557,136605799,1811990,"From the art style to the replayability and gameplay; this game is a worthy deckbuilder.
Plus, it has good accessibility options. 9.75/10",1
558,136605543,1811990,"A really fun game, even thought its pretty hard to win a lot of fights in a row. If you fuck up once then thats it, at least when it comes to the bosses which forces you to think a lot, which is something i enjoy.",1
559,136605962,1811990,"Is the game hard? Yes.
Is the game unbalanced? No.
Do you need to think carefully or get screwed? Yes.
3 hrs (+3 from demo) to complete first run and I suck at RoR Monsoon.
Play smart, play slow and you'll be fine. 
Great art & music, highly recommend.",1
560,136605989,1811990,"This game is far better than the mixed status gives it credit for.

it's a rogue-like deck builder. Well built, haven't run into any bugs.

I find it fun it has a nice unified card style and offers a fair amount of strategy.
",1
561,136607980,1811990,Sensational,1
562,136608071,1811990,"I played this when the first demo came out. I was obsessed with it then and I am obsessed with it now. 

It's an amazing game. It's well designed. The art is beautiful. 
Yes, it's difficult... but I actually love that about this game - it feels more meaningful when I press on. It makes me want to try harder and get better at creating decks. 

I do think that maybe the balance needs readjusted a tiny bit - but it's not so bad that it makes me hate the game or not want to recommend it.

I definitely think it's a great game with great music, art, and gameplay... it's been released for a day since I wrote this - I am sure there will be balancing in the future or future updates in general. Overall, I think it's a game that is worth the money and has kept me entertained for hours (including the demos and now the released version). 

",1
563,136607239,1772830,"An incredibly imaginative game that deserves just as much praise as any Metroidvania on the market. Rock-solid movement, creative boss fights, beautiful visuals and sound. Play this game.",1
564,136611352,1772830,"This game is a pretty good, casual Metroidvania game, and for that alone it's pretty good. However, what really draws me into this game is the fact that it has some of the most nuance to movement that's also extremely easy to grasp/learn. Slingshotting with the grapple and bunny hopping through rooms isn't as hard as other games, but it's extremely satisfying to pull off. This game is going to have so many cool skips/movement tech, which to me is what elevates a Metroidvania from ""good"" to ""great.""",1
565,136611125,1949030,Have been enjoying it!,1
566,136610991,1949030,"Terrifically moody and hugely satisfying when it comes to making you feel like a genius sleuth, Frogwares prove themselves absolute masters of their craft, even under extraordinary duress.",1
567,136611945,2285400,"PROS
- fun design
- challenging
- can keep playing for hours
- decent amount of cards to mess around with
- speed up round button

CONS
- little replay-ability
- no rewards after beating maps
- very little outside of pure tower-defense
- does not feel finished",1
568,136612012,1949030,A fun Lovecraftian adventure.,1
569,136610454,1772830,"This game is great, but it is also relatively demanding. There is 'a lot' going on with the mechanics of the grapple that you have to come to terms with, and it can sometimes be unclear if you need to unlock a new ability to continue or if you just need to get better at manipulating the grappling hook. Definitely worth it's asking price. There is an Assisted mode for people struggling to get the movement down as well.",1
570,136611749,1118110,"Waited so eagerly for this game to release
Thoight itd never happen. Regretting it now... to put it simply, its very janky. 
And the choice of a tiny little excavator to load a truck.. backwards forwards backwards forwards you get the drift.. the controls are clunky and difficult.
Its a grind and not in a good way. No fps issues at all but damn driving an articulated underground truck that slides around corners rather than turns... so many things that should have been tested better before release so many things that worked better in the prologue how it dosnt work right now we will proba ly never know. If your thinking of buying the game by all means see for your self but oersonaly id give it a few months and see if things change a little. It remains an awsome concept and has the potential to be a great game but a fair amount of work is needed to get it there.",0
571,136611439,307950,Not very fun.,0
572,136611295,307950,Game runs great and after moving from the launcher to steam i couldn't be happier,1
573,136611681,307950,"That game is a complete waste of time, and I wouldn't recommend it to anyone. The graphics are terrible, the gameplay is clunky, and the overall design is lazy. It's just another generic shooter that offers nothing new or exciting.",0
574,136611760,307950,"They have Ben-Gvir's Israeli Militia in the game, cool monkaLaugh 👍",0
575,136606511,2207970,"Sodaraptor knocks it out of the park with this game. It grabs a hold of you and transports you to places between other places. It is both alive and dead, here and there. The locations and objectives bring together a very lovely and haunting experience to remember well after the credits roll!",1
576,136603652,1091920,"I'm so happy that this game is finally released!! <3 I was waiting since I heard that a second game was going to be developed, I always felt that some things could be add when I was playing the first version of this, so you can imagine how happy I was when I realised that VaragtP also wanted more for Plantera! :)

About the Game:
• Gameplay: The mechanics have a grind-idle game style, so its a very relaxing-cozy game to play
• Graphics: Those pixel arts are simply adorable and respects and carry the model of the first version (thumbs up for that!!)

You can manage and build your own garden, the game pass a farming simulation vibe, once you start, you cannot stop, its a very addictive game!

I hope this version be longer than the first one, I have good first impressions of this, so I recommend anyone to give it a try since the price is nicely affordable!!",1
577,136611095,1811990,"Fun, challenging, and requires you to think ahead. You don't necessarily know exactly what you're going to encounter, but for the most part the enemies are very similar in each zone, and y. The art is cute and the musical composition is great (although several hours of hearing the same music will get old.) I do also appreciate how the mechanics are well-explained (if you right-click on cards) and enemy actions are always (with the one exception of [spoiler]Aimless[/spoiler] as well as [spoiler]enemies who explicitly have ""apply X to random enemy"" modifiers[/spoiler]) predictable. Same goes for your own turns.

The comments about balancing are somewhat unreasonable - this game hasn't been out even a day, much less had time for people to develop proper strategies for this. I had some exposure to the game from watching a streamer play it prior to launch, and you definitely can develop a strategy to go forward, even if it's not 100% successful. Yes, it's hard, and you die a lot, and there's RNG (like any roguelike), but it is one of those games that requires time spent to unlock more and get used to the mechanics to make your runs more successful. The RNG is primarily constrained to what cards/charms you get, as with most any deckbuilder.

To the devs: there [i]may[/i] be opportunities to change the balancing in the future, but please wait a bit and see what community forms around this game first before completely nerfing it.

Anyway, I didn't consider myself a fan of this genre, but this game's charm drew me in and the slowly expanding mechanics makes it very replayable.",1
578,136611508,1811990,"3 different factions, each with a few different archetypes makes this a very replayable deckbhilder. I enjoy the round based combat, it's a differentiator from the ever present energy systems. Many different effecay via charms. Unlockable additional cards, and an ever changing endgame bias. Very fun, the art style is very charming.",1
579,136611906,1811990,fun,1
580,136611263,307950,i dig it,1
581,136611292,307950,Garbage.,0
582,136610173,307950,"played this a bit during its beta and my god, its so much better than before. is it pay2win? yeah ill admit that it is but im gonna be honest, the 3rd person tactical shooter pve itch is finally getting a scratch so fuck it idc. cant get wallet warriored if youre killing bots in pve so id recommend giving it a go just for the fun pve",1
583,136611177,307950,love this game has great gunplay and all round feels really good,1
584,136611034,307950,Dog shit,0
585,136611999,1893370,"I didn't really have fun, I was expecting more of a game than what is basically UT99 Vs bots. 

The creepy secret side of things doesn't really feel very interesting and nothing took me by surprise sadly. I was looking forward to playing a handful of arena shooter Vs bots bits and then having the meat of the game start showing up, but it seems the meat of the game is you being satisfied with shooting bots which is uhhhh. If you like that sort of thing, cool. I had my fill back before I had a good internet connection.

Movement is a bit rubbish too, but I can't really remember why it just feels ""off"". FPS is capped to 90 maximum too which is a strange choice.

In short, you can get a better experience by doing the following:

Watch a Mortal Kombat prefight cutscene
Load up a map Vs bots in UT99 and fight a bit until you hit 10 frags
Load up your favourite single player FPS and play that for 10 mins
Repeat",0
586,136611701,1091920,"I'm Rames, and I recommend dis game.

It's like the first, but better and runs very smoothly with almost no bugs experienced (on my end)

So, in furiously playing, I was able to beat the game on my first time opening the game with 3.1 hours and all 30 achievements. I set out to complete the game before sleeping lol.

Whether you get the game at its introductory sale or regular price, it's a complete game that does whats promised.
My hand hurts but honestly, play this more casually unless you're trying to go for some speed run record.

I will say the only negative is that in playing the game how I did, I didn't unlock all the plot expansions and I never had to close the game and receive idle income. So even though I used gold on the upgrade, I have no idea how good the passive income is when the game is closed.",1
587,136611627,1527950,"Overall this is a fun game.  I always enjoyed RPG like settings with larger groups, and this game certainly lets you do that.  It's not overly heavy on the RPG side though, pretty thin for story and dialogue, but it's forte is turn based combat.  

PROs
- Great map interaction, full of little Easter eggs to find
- Fun game-like interactions with picking locks, solving puzzles, using skills, finding hidden objects by searching the screen with cursor etc...
- Large groups!
- Can recruit animals

CONs
- Hard to get going in the early levels, as your small party takes a beating and needs repairs and healing often; gets easier with more members as the overall damage gets spread out between everyone
- Combat gets tedious toward the end, and gets very lopsided with your band gets larger
- Each map zone has a different back story quest to solve, but over all they're identical in nature.  Main quest, side missions from tavern contacts, and random missions to stumble upon.
- Traveling the map is a chore with the length of day and having to rest... seems like you can't travel more than a minute before you have to rest again.  Really needs to be addressed as it's a big detractor from just trying to get around the map and enjoy the game
- Very simple combat system... armor is extra hp, and all damage types translate to hp damage.  There's no chance of missing/dodging an attack during melee, so you area always getting hit every time.  Each side trades turns until one side eventually has more people left
- Tedious having to constantly pay and feed your party, but camp site structures help reduce that headache
- Not a big mix of enemies
- You can buy pack ""ponies"" for hauling more gear, but can't ride horses to make traveling faster?!
- lack of in game quest guide tips, had to use youtube videos at times to figure out what was going on in some quests

I played this game on the fixed level option, so each zone had a set level range.  The starter zone was challenging to get going.  The second zone was fair, but after completing it I out leveled the third zone to the SW and quickly ran through that quest and all missions in a single round of combat every time (think I was lvl 5-6 and the enemy was level 3 or so.  By the time I got the the last zone in the east, I had already started to collect bears for fun, and ended up with 12 or so bears as they're more common on the harder zones (had wolves too but let them go as the bears racked up), and 14 other guys.  It ended up silly as the bears are absolute tanks with 1000+ hp, and can hit for 70+ damage and take up a lot of map space squares to provide nice meat shields for the rest of my party.  I could have just dumped all my human members except for a couple and a beast master, and just played the bears.  The good thing with having animals is you only need to feed them, not pay them, and you don't have to fully feed your group as the other camp bonuses make up for losing happiness due to lack of food.",1
588,136611569,1527950,very nice game!,1
589,136610710,1527950,yes,1
590,136610364,1091920,Runs great on Steam Deck.,1
591,136611677,1527950,I love it,1
592,136611206,1091920,Yesss!,1
593,136610828,1091920,"For a few bucks, well worth it. Fun little idle clicker to have running on other screen.",1
